[
  {
    "actual_direction": null,
    "check_due_at": "2026-07-20",
    "corrected_at": null,
    "correction_reason": null,
    "evidence": "실제 변화가 예상한 상승 방향과 다르게 움직였습니다.",
    "expected_direction": "up",
    "issued_at": "2026-07-19T12:20:56+09:00",
    "locked_at": "2026-07-19T12:20:56+09:00",
    "method_version": "proxy-pct_020",
    "observation_as_of": "2026-07-17",
    "observation_unit": "원",
    "observation_value": 1487.46,
    "question": "원/달러 환율이 다음 거래일까지 추가 상승할지 관찰이 필요합니다.",
    "question_id": "2026-07-19-c1",
    "result_unit": "%",
    "result_value": 1481.21,
    "status": "miss",
    "verdict": "miss"
  },
  {
    "actual_direction": null,
    "check_due_at": "2026-07-21",
    "corrected_at": null,
    "correction_reason": null,
    "evidence": "실제 변화가 예상한 상승 방향과 다르게 움직였습니다.",
    "expected_direction": "up",
    "issued_at": "2026-07-20T06:43:48+09:00",
    "locked_at": "2026-07-20T06:43:48+09:00",
    "method_version": "proxy-pct_020",
    "observation_as_of": "2026-07-19",
    "observation_unit": "원",
    "observation_value": 1486.53,
    "question": "다음 거래일까지 원/달러 환율이 상승세를 이어갈 가능성이 있습니다.",
    "question_id": "2026-07-20-c1",
    "result_unit": "%",
    "result_value": 1481.21,
    "status": "miss",
    "verdict": "miss"
  },
  {
    "actual_direction": null,
    "check_due_at": "2026-07-21",
    "corrected_at": null,
    "correction_reason": null,
    "evidence": "실제 변화가 예상한 하락 방향과 일치했습니다.",
    "expected_direction": "down",
    "issued_at": "2026-07-20T06:43:48+09:00",
    "locked_at": "2026-07-20T06:43:48+09:00",
    "method_version": "proxy-pct_030",
    "observation_as_of": "2026-07-16",
    "observation_unit": "kospi",
    "observation_value": 6820.6,
    "question": "다음 거래일까지 코스피 지수가 하락 흐름을 지속하거나 변동성이 높게 유지될 가능성이 있습니다.",
    "question_id": "2026-07-20-c2",
    "result_unit": "%",
    "result_value": 6516.27,
    "status": "hit",
    "verdict": "hit"
  },
  {
    "actual_direction": null,
    "check_due_at": "2026-07-23",
    "corrected_at": null,
    "correction_reason": null,
    "evidence": "변화폭이 중립 구간(±0.2%) 이내에 머물러 뚜렷한 방향이 나타나지 않았습니다.",
    "expected_direction": "up",
    "issued_at": "2026-07-22T08:05:18+09:00",
    "locked_at": "2026-07-22T08:05:18+09:00",
    "method_version": "proxy-pct_020",
    "observation_as_of": "2026-07-21",
    "observation_unit": "원",
    "observation_value": 1479.78,
    "question": "원/달러 환율은 다음 거래일까지 상승세를 이어갈까?",
    "question_id": "2026-07-22-c1",
    "result_unit": "%",
    "result_value": 1479.18,
    "status": "neutral",
    "verdict": "neutral"
  },
  {
    "actual_direction": null,
    "check_due_at": "2026-07-24",
    "corrected_at": null,
    "correction_reason": null,
    "evidence": "변화폭이 중립 구간(±0.2%) 이내에 머물러 뚜렷한 방향이 나타나지 않았습니다.",
    "expected_direction": "down",
    "issued_at": "2026-07-23T06:43:32+09:00",
    "locked_at": "2026-07-23T06:43:32+09:00",
    "method_version": "proxy-pct_020",
    "observation_as_of": "2026-07-22",
    "observation_unit": "원",
    "observation_value": 1476.62,
    "question": "원/달러 환율은 다음 거래일까지 하락세를 이어갈까?",
    "question_id": "2026-07-23-c1",
    "result_unit": "%",
    "result_value": 1474.12,
    "status": "neutral",
    "verdict": "neutral"
  },
  {
    "actual_direction": null,
    "check_due_at": "2026-07-25",
    "corrected_at": null,
    "correction_reason": null,
    "evidence": "실제 변화가 예상한 하락 방향과 일치했습니다.",
    "expected_direction": "down",
    "issued_at": "2026-07-24T06:44:34+09:00",
    "locked_at": "2026-07-24T06:44:34+09:00",
    "method_version": "proxy-pct_020",
    "observation_as_of": "2026-07-23",
    "observation_unit": "원",
    "observation_value": 1474.12,
    "question": "원/달러 환율은 다음 거래일까지 하락세를 이어갈까요?",
    "question_id": "2026-07-24-c1",
    "result_unit": "%",
    "result_value": 1459.42,
    "status": "hit",
    "verdict": "hit"
  },
  {
    "actual_direction": null,
    "check_due_at": "2026-07-26",
    "corrected_at": null,
    "correction_reason": null,
    "evidence": "변화폭이 중립 구간(±0.2%) 이내에 머물러 뚜렷한 방향이 나타나지 않았습니다.",
    "expected_direction": "down",
    "issued_at": "2026-07-25T06:43:55+09:00",
    "locked_at": "2026-07-25T06:43:55+09:00",
    "method_version": "proxy-pct_020",
    "observation_as_of": "2026-07-24",
    "observation_unit": "원",
    "observation_value": 1459.42,
    "question": "원/달러 환율은 다음 거래일에도 하락세를 이어갈까?",
    "question_id": "2026-07-25-c1",
    "result_unit": "%",
    "result_value": 1459.42,
    "status": "neutral",
    "verdict": "neutral"
  },
  {
    "actual_direction": null,
    "check_due_at": "2026-07-28",
    "corrected_at": null,
    "correction_reason": null,
    "evidence": "실제 변화가 예상한 하락 방향과 다르게 움직였습니다.",
    "expected_direction": "down",
    "issued_at": "2026-07-27T06:43:44+09:00",
    "locked_at": "2026-07-27T06:43:44+09:00",
    "method_version": "proxy-pct_030",
    "observation_as_of": "2026-07-24",
    "observation_unit": "kospi",
    "observation_value": 6690.62,
    "question": "코스피 지수는 다음 거래일까지 하락세를 이어갈까?",
    "question_id": "2026-07-27-c1",
    "result_unit": "%",
    "result_value": 6755.75,
    "status": "miss",
    "verdict": "miss"
  },
  {
    "actual_direction": null,
    "check_due_at": "2026-07-29",
    "corrected_at": null,
    "correction_reason": null,
    "evidence": "실제 변화가 예상한 상승 방향과 다르게 움직였습니다.",
    "expected_direction": "up",
    "issued_at": "2026-07-28T06:43:49+09:00",
    "locked_at": "2026-07-28T06:43:49+09:00",
    "method_version": "proxy-pct_020",
    "observation_as_of": "2026-07-27",
    "observation_unit": "원",
    "observation_value": 1465.79,
    "question": "원/달러 환율은 다음 거래일까지 상승세를 이어갈까요?",
    "question_id": "2026-07-28-c1",
    "result_unit": "%",
    "result_value": 1453.87,
    "status": "miss",
    "verdict": "miss"
  },
  {
    "actual_direction": null,
    "check_due_at": "2026-07-30",
    "corrected_at": null,
    "correction_reason": null,
    "evidence": "실제 변화가 예상한 하락 방향과 일치했습니다.",
    "expected_direction": "down",
    "issued_at": "2026-07-29T06:43:27+09:00",
    "locked_at": "2026-07-29T06:43:27+09:00",
    "method_version": "proxy-pct_020",
    "observation_as_of": "2026-07-28",
    "observation_unit": "원",
    "observation_value": 1453.87,
    "question": "원/달러 환율은 다음 거래일까지 원화 강세 흐름을 이어갈까?",
    "question_id": "2026-07-29-c1",
    "result_unit": "%",
    "result_value": 1443.8,
    "status": "hit",
    "verdict": "hit"
  },
  {
    "actual_direction": null,
    "check_due_at": "2026-07-31",
    "corrected_at": null,
    "correction_reason": null,
    "evidence": null,
    "expected_direction": "up",
    "issued_at": "2026-07-30T06:43:33+09:00",
    "locked_at": "2026-07-30T06:43:33+09:00",
    "method_version": "proxy-abs_003pp",
    "observation_as_of": "2026-07-29",
    "observation_unit": "%p",
    "observation_value": 4.62,
    "question": "미국채 10년물 금리는 다음 거래일까지 상승세를 이어갈까?",
    "question_id": "2026-07-30-c1",
    "result_unit": null,
    "result_value": null,
    "status": "unresolved",
    "verdict": "unresolved"
  }
]
